{
  "$schema": "./robots.schema.json",
  "about": "What each robot dimos supports can run, for dimOS Desktop's Launcher and anyone else who wants it. Checked against the code by dimos/server/test_robots.py (dimos/server/robots.py says how); served by the dimos server at GET /dimos/robots.",
  "tags": {
    "drive": {
      "label": "Drive",
      "description": "Something in it takes velocity commands (cmd_vel): drive it from an app, the keyboard, a phone or clicks."
    },
    "map": {
      "label": "Map",
      "description": "Builds a map (SLAM, a voxel map or a costmap)."
    },
    "navigate": {
      "label": "Navigate",
      "description": "Plans and follows paths to a goal, or explores."
    },
    "perceive": {
      "label": "Perceive",
      "description": "Cameras plus detection, tracking, memory or a vision-language model."
    },
    "agent": {
      "label": "Agent",
      "description": "An AI agent (MCP skills) you can talk to."
    },
    "teleop": {
      "label": "Teleop",
      "description": "Driven by a person: keyboard, phone, VR headset, remote broker."
    },
    "arm": {
      "label": "Arm",
      "description": "Moves a manipulator arm."
    },
    "record": {
      "label": "Record",
      "description": "Records what it sees for later replay or training."
    },
    "replay": {
      "label": "Replay",
      "description": "Runs on a recording, no hardware (the blueprint has a replay mode)."
    },
    "sim": {
      "label": "Sim",
      "description": "Runs in a simulator, no hardware (the blueprint has a sim mode)."
    },
    "test": {
      "label": "Test",
      "description": "A test, benchmark or mock: for developers."
    }
  },
  "modes": {
    "robot": {
      "label": "Robot",
      "description": "On the real hardware."
    },
    "replay": {
      "label": "Replay",
      "description": "On a recording."
    },
    "sim": {
      "label": "Simulator",
      "description": "In a simulator."
    }
  },
  "groups": {
    "arms": {
      "name": "Arms"
    }
  },
  "args": {
    "go2_ip": {
      "global": "robot_ip",
      "label": "Robot IP",
      "placeholder": "192.168.12.1",
      "required": true,
      "docs": "https://docs.dimensional.org/platforms/quadruped/go2/setup/#first-time-setup-connecting-to-wifi-finding-robot-ip"
    },
    "g1_ip": {
      "global": "robot_ip",
      "label": "Robot IP",
      "placeholder": "192.168.123.164",
      "required": true,
      "docs": "https://docs.dimensional.org/platforms/humanoid/g1/#1-get-ssh-access"
    },
    "go2_recording": {
      "global": "replay_db",
      "label": "Recording",
      "kind": "recording",
      "default": "go2_short",
      "streams": [
        [
          "go2_lidar",
          "lidar"
        ],
        [
          "go2_odom",
          "odom"
        ],
        [
          "color_image"
        ]
      ]
    },
    "robot_ips": {
      "global": "robot_ips",
      "label": "Robot IPs",
      "placeholder": "192.168.12.1,192.168.12.2",
      "required": true,
      "docs": "https://docs.dimensional.org/platforms/quadruped/go2/setup/#first-time-setup-connecting-to-wifi-finding-robot-ip"
    },
    "spot_ip": {
      "module": "spothighlevel",
      "field": "ip",
      "label": "Spot IP",
      "placeholder": "found automatically"
    },
    "spot_recording": {
      "module": "spotreplay",
      "field": "db_path",
      "label": "Recording",
      "placeholder": "the latest Spot recording"
    },
    "drone_connection": {
      "module": "droneconnectionmodule",
      "field": "connection_string",
      "label": "MAVLink connection",
      "placeholder": "udp:0.0.0.0:14550"
    },
    "m20_host": {
      "module": "m20connection",
      "field": "basic_server_host",
      "label": "M20 control host",
      "placeholder": "10.21.31.103"
    },
    "alfred_address": {
      "module": "alfredhighlevel",
      "field": "address",
      "label": "Alfred address"
    },
    "xarm7_ip": {
      "global": "xarm7_ip",
      "label": "xArm7 IP",
      "placeholder": "192.168.1.185",
      "required": false
    },
    "xarm6_ip": {
      "global": "xarm6_ip",
      "label": "xArm6 IP",
      "placeholder": "192.168.1.185",
      "required": false
    },
    "lite6_ip": {
      "global": "lite6_ip",
      "label": "Lite6 IP",
      "placeholder": "192.168.1.185",
      "required": false
    },
    "can_port": {
      "global": "can_port",
      "label": "CAN port",
      "placeholder": "can0"
    },
    "device_path": {
      "global": "device_path",
      "label": "Device",
      "placeholder": "/dev/ttyUSB0"
    },
    "recording": {
      "global": "replay_db",
      "label": "Recording",
      "kind": "recording"
    }
  },
  "robots": {
    "go2": {
      "name": "Unitree Go2",
      "description": "Unitree's quadruped: camera, lidar, WebRTC, DDS or a zenoh bridge.",
      "type": "dog",
      "manufacturer": "Unitree",
      "dirs": [
        "dimos/robot/unitree/go2"
      ],
      "recommended_app": {
        "id": "dim-go2-dash",
        "title": "Go2 Ctrl",
        "url": "https://github.com/jeff-hykin/dim-go2-dash",
        "ref": "main"
      },
      "recommended": [
        "unitree-go2-basic",
        "unitree-go2",
        "unitree-go2-agentic",
        "unitree-go2-webrtc-keyboard-teleop"
      ],
      "defaults": {
        "recommended_config": [
          {
            "global": "simulation",
            "label": "Run it on",
            "choices": [
              {
                "value": "",
                "label": "The real Go2"
              },
              {
                "value": "mujoco",
                "label": "The MuJoCo simulator"
              }
            ],
            "default": ""
          },
          {
            "arg": "go2_ip"
          }
        ],
        "modes": {
          "robot": {
            "args": [
              "go2_ip"
            ]
          },
          "replay": {
            "set": {
              "replay": true
            },
            "args": [
              "go2_recording"
            ]
          },
          "sim": {
            "set": {
              "simulation": "mujoco"
            }
          }
        }
      },
      "blueprints": {
        "unitree-go2-basic": {
          "title": "Go2 basic",
          "description": "Connects to a Go2 and streams its camera, lidar and pose. The simplest way to get a Go2 going: drive it from Controller.",
          "tags": [
            "drive"
          ],
          "starter": 1
        },
        "unitree-go2": {
          "title": "Go2 with map + navigation",
          "description": "Builds a 3D map and a costmap as it walks; click a spot to send it there, or let it explore on its own.",
          "tags": [
            "drive",
            "map",
            "navigate"
          ],
          "starter": 2
        },
        "unitree-go2-agentic": {
          "title": "Go2 with an agent",
          "description": "Map and navigation plus an AI agent you can talk to (over MCP), with a memory of what it has seen.",
          "tags": [
            "drive",
            "map",
            "navigate",
            "perceive",
            "agent"
          ],
          "starter": 3
        },
        "unitree-go2-webrtc-keyboard-teleop": {
          "title": "Go2 keyboard driving",
          "description": "Drive a Go2 with this computer's keyboard, over WebRTC.",
          "tags": [
            "drive",
            "teleop"
          ],
          "starter": 4
        },
        "unitree-go2-detection": {
          "title": "Go2 with 3D detection",
          "description": "Map and navigation plus 3D object detection on its camera.",
          "tags": [
            "drive",
            "map",
            "navigate",
            "perceive"
          ],
          "starter": 5
        },
        "teleop-phone-go2": {
          "title": "Go2 phone driving",
          "description": "Drive a Go2 from a phone's touch controls.",
          "tags": [
            "drive",
            "teleop"
          ],
          "modes": {
            "robot": {
              "args": [
                "go2_ip"
              ]
            }
          },
          "starter": 6
        },
        "unitree-go2-agentic-cockpit": {
          "title": "Go2 agent with a cockpit",
          "description": "The Go2 agent with an authored cockpit: video over the 3D voxel map.",
          "tags": [
            "drive",
            "map",
            "navigate",
            "perceive",
            "agent"
          ]
        },
        "unitree-go2-agentic-huggingface": {
          "title": "Go2 agent (Hugging Face model)",
          "description": "The Go2 agent with its language model served from Hugging Face.",
          "tags": [
            "drive",
            "map",
            "navigate",
            "perceive",
            "agent"
          ]
        },
        "unitree-go2-agentic-ollama": {
          "title": "Go2 agent (Ollama model)",
          "description": "The Go2 agent with a local language model served by Ollama.",
          "tags": [
            "drive",
            "map",
            "navigate",
            "perceive",
            "agent"
          ]
        },
        "unitree-go2-cockpit": {
          "title": "Go2 with a cockpit",
          "description": "Map and navigation with an authored cockpit: video over the 3D voxel map.",
          "tags": [
            "drive",
            "map",
            "navigate"
          ]
        },
        "unitree-go2-coordinator": {
          "title": "Go2 control coordinator",
          "description": "A Go2 behind dimos's ControlCoordinator (the base for controller experiments).",
          "tags": [
            "drive"
          ],
          "modes": {
            "robot": {
              "args": [
                "go2_ip"
              ]
            }
          }
        },
        "unitree-go2-fleet": {
          "title": "Go2 fleet",